{
  "assetHash": "a2b2a2e34c477059",
  "durationSec": 20.0,
  "segments": [
    {
      "startSec": 0.0,
      "endSec": 20.0,
      "labels": [
        {
          "category": "gambling",
          "intensity": "strong"
        },
        {
          "category": "advertising",
          "intensity": "mild"
        }
      ],
      "confidence": 0.95
    }
  ],
  "signals": {
    "baitPattern": false,
    "syntheticSuspected": false,
    "engineeredPacing": false
  },
  "modelVersion": "palette/2026-09-30",
  "computedAt": "2026-09-30T16:43:43Z"
}
