{
  "assetHash": "8cbfca23cf5473c8",
  "durationSec": 96.0,
  "segments": [
    {
      "startSec": 0.0,
      "endSec": 96.0,
      "labels": [
        {
          "category": "music",
          "intensity": "none"
        }
      ],
      "confidence": 0.95
    }
  ],
  "signals": {
    "baitPattern": false,
    "syntheticSuspected": false,
    "engineeredPacing": false
  },
  "modelVersion": "palette/2026-09-30",
  "computedAt": "2026-09-30T16:43:43Z"
}
